{
  "type": "sessionState",
  "sessionId": "k3Jx9QvT2mLpZ8wR4nYb7A",
  "version": 12,
  "selfParticipantId": "3f6c2a1e-8b4d-4c7a-9e2f-1d5b6a7c8e90",
  "round": {
    "roundId": "Vn4pX9tA",
    "status": "HIDDEN"
  },
  "participants": [
    {
      "participantId": "3f6c2a1e-8b4d-4c7a-9e2f-1d5b6a7c8e90",
      "pseudo": "Alice",
      "role": "VOTER",
      "connected": true,
      "joinOrder": 1,
      "hasVoted": false,
      "vote": null,
      "canVoteThisRound": true
    },
    {
      "participantId": "7d2e9f4a-1c3b-4e5d-8a6f-2b9c0d1e3f45",
      "pseudo": "Bob",
      "role": "VOTER",
      "connected": true,
      "joinOrder": 2,
      "hasVoted": true,
      "vote": null,
      "canVoteThisRound": true
    },
    {
      "participantId": "5b6c7d8e-9f0a-4b1c-8d2e-3f4a5b6c7d8e",
      "pseudo": "Emma",
      "role": "OBSERVER",
      "connected": true,
      "joinOrder": 5,
      "hasVoted": false,
      "vote": null,
      "canVoteThisRound": false
    }
  ],
  "progress": {
    "voted": 1,
    "expected": 2
  },
  "summary": null,
  "lastChange": {
    "action": "LEAVE",
    "byParticipantId": null
  },
  "deck": { "type": "FIBONACCI", "cards": ["0", "0.5", "1", "2", "3", "5", "8", "13", "21", "?", "coffee"] }
}
